ID,Purpose,Test steps
21,Security log,Verify that all relevant information is logged in the security log
23,Log date and system time,Verify that all entries in the log contain the date and system time
29,Switching on and off and status of breakers from other GE system,Verify that switching on is not possible by integration from other system. Verify that switching off is not possible by integration from other system. Verify that status of switches is possible to see by integration.
32,Send the same info again,Receive same info from file. Receive same info from meter
63,Lifetime Cat1,A Metering Unit shall have a life expectancy of 15 years from the date of delivery to GE.
78,Dependencies with other systems,"For example, turn off the connection between Collection Manager and OMNIA Flex."
86,Testing tools,The Contractor shall use a tool designated by the Contracting Authority to follow the Contracting Authority's reporting of test results. The Supplier is responsible for registering in the tool its feedback and status on the Customer's reported errors and comments. The Client currently uses ReQtest in the defect management process.
98,Scope of UAT,The purchaser's UAT (User Acceptance Test) shall include testing and verification of all requirements of the Specification unless otherwise agreed.
99,Training for UAT,The Contractor shall carry out the necessary training and submit the relevant documentation according to point 5 before the start of the Customer's UAT.
141,Metering units in HES,"Verify that it is possible to install new Metering Unit - Cat 1, 1 phase. Verify that it is possible to install new Metering Unit - Cat 1, 3 phase. Verify that it is possible to install new Metering Unit - Cat 2. Replace meter type Cat 1, 1 phase. Replace meter type Cat 1, 3 phase. Replace meter type Cat 2. Take down meter type Cat 1, 1 phase. Take down meter type Cat 1, 3 phase. Take down meter type Cat 2"
149,Automatic collection of Measured values,Verify that the metering system can be configured for regular automatic collection of Measurement values from Metering Units to HES.
237,Detecting meters with communication problems,Verify that in HES it is possible for the User to detect and see individual Metering Units that have communication problems.
255,Display of PQ values,Verify that in HES it is possible to analyze and visualize PQ values in e.g. graphs and bars.
271,copy static fields,"Verify that it is possible to copy static fields in HES such as headers, status, responses to Events in the system."
273,Request further confirmation,"Verify that commands, initiated by the User in HES, which may have serious consequences in case of incorrect handling (deletion of stored measurement and structure data and switching off and on of power) require additional confirmation before being executed. Verify that commands which do not have serious consequences do not require additional confirmation before being executed."
274,Mass deletion,Verify that in HES there is a function to perform mass deletion of overall structure data objects so that all linked relations are also deleted. E.g. that this is implemented via group membership.
310,Measurement and recording / phase,"Verify that the Metering Unit for each phase is able to measure and record the minimum, maximum and average value of voltage, current, active and reactive power of the electricity output and input per 5 minutes."
319,Record communication errors,"Verify that the Metering System is able to record and store information when the following Events occur:
8. communication failure"
330,Register overheating in connection,"Verify that the Metering System is able to record and store information when the following Events occur:
17. In case of connection overheating"
348,Status of the customer interface,Verify that in HES it is possible to see if the Customer Interface in a Metering Unit is enabled or disabled for data sending.
358,Response times in the user interface,"Verify that HES user interface response times do not exceed:
- 0.5 s from input, keystroke or equivalent to first response on screen
- 0.5 s for display of form view including data
- 5 s for viewing simple report
- 15 s for login"
430,Management of both primary and secondary registration - Cat2,Verify that the Metering Units can handle primary registration of Measured Values. Verify that the Metering Units can handle secondary registration of Measured Values.
471,sealing device - Cat1,Verify that the sealing device of the Metering Unit is raised and clearly visible for smooth and accessible passage of the sealing wire.
472,sealing device - Cat2,Verify that the sealing device of the Metering Unit is raised and clearly visible for smooth and accessible passage of the sealing wire.
478,Management of both primary and secondary registration - Cat1,Verify that the Metering Units can handle both primary and secondary recording of Metering Values.
479,Licensed telecommunications networks,Verify that the licensed telecommunications network complies with Ordinances and Regulations in accordance with PTSFS 2015:2 issued by PTS (Post- och Telestyrelsen).
485,Lifetime Cat2,A Metering Unit shall have a life expectancy of 15 years from the date of delivery to GE.
489,Recovery time after communication breakdown max 60 min,Break the communication link from meter. Voltage is left in meter. Wait one hour and turn on the link again.
616,Installation of new metering device via integration,Information regarding structure data for new set-up is sent from the integration interface Mint to Collection Manager. Verify that information entered on the user point in Collection Manager corresponds to what is specified in the Work Order. An acknowledgment is sent to Generis that the meter is set up in Collection Manager. Check that the user point is displayed under the correct coordinates in the map view in Vision. Check that the meter has the correct profile and that Energy values. PQ values and GSM diagnostics are pushed from the meter at the correct interval.
618,Dismantling of metering unit via integration,Information regarding the structure data for the removal of a metering unit is sent from the integration interface Mint to Collection Manager. Verify that the metering unit is removed in Collection Manager and does not have a connection to the user point.
619,Update of measurement point in CM,Information regarding the structure data for updating a metering unit is sent from the integration interface Mint to Collection Manager. Verify that the information to be updated via Mint has also been changed at the current user point.
620,New Metering Unit is set up in CM and taken down in ACM - Take down fails in ACM,Initiate a new set-up of a metering unit in CM and ensure that the metering unit is still in ACM when the new set-up is carried out in CM. A message is sent from CM to Generis stating that the metering unit in ACM is not taken down.
621,New Metering Unit is set up in CM and taken down in AiMiR - Take down fails in AiMiR,Initiate a new set-up of a metering unit in CM and ensure that the metering unit remains in AiMiR when the new set-up is carried out in CM. Mail is sent to the AiMir box.
622,New Metering Unit is set up in CM and taken down in ACM - Set-up fails in CM,Initiate a new set-up of a metering unit in CM and make sure that the metering unit is already connected to another facility in CM. Message is sent from CM to Generis stating that the metering unit is not created in CM.
623,New Metering Unit is set up in CM and taken down in AiMiR - Set-up fails in CM,Initiate a new set-up of a metering unit in CM and ensure that the metering unit is still in AiMir when the new set-up is carried out in CM. A message is sent from CM to Generis stating that the metering unit has not been created in CM.
624,Existing Metering Unit is changed in CM - Meter change fails in CM,Initiate a meter change of an existing metering unit in CM to a New Metering Unit. Enter incorrect serial number for the existing meter in the Work Order. Message is sent from CM to Generis stating that the metering unit is not created in CM. Verify the status of the work order in Generis.
625,New metering unit set up in CM - Set up fails in CM,Initiate new installation of a metering unit in CM. Enter a serial number for the metering unit already connected to an installation in the work order. Message is sent from CM to Generis stating that the metering unit is not created in CM. Verify the status of the work order in Generis.
626,Metering unit is taken down in CM - Take-down fails in CM,Initiate a removal of a metering unit in CM where mandatory information in the work order is not complete. Message is sent from CM to Generis stating that the metering unit is not removed in CM. Verify the status of the work order in Generis.
642,Hardware for the user interface,"HES shall be designed to be used with different types of computers, tablets and smart phones, with different architectures and operating systems."
