ID,Feature,Description
R-173,ıt shall be possible to open local files (both HTML and plain text tested) in a Composer window (including the dismiss dialog).,ıt shall be possible to open local files (both HTML and plain text tested) in a Composer window (including the dismiss dialog).
R-174,Error shall be displayed while trying to open a nonexistent (bogus) local file.,Error shall be displayed while trying to open a nonexistent (bogus) local file.
R-175,Both Classic and Modern themes shall exist under the themes preferences.,Both Classic and Modern themes shall exist under the themes preferences.
R-176,Classic theme shall be displayed as in the given image.,Classic theme shall be displayed as in the given image.
R-177,Modern theme shall be displayed as in the given image.,Modern theme shall be displayed as in the given image.
R-178,"""Theme Preferences"" item shall be available under View menu.","""Theme Preferences"" item shall be available under View menu."
R-179,"""Get New Themes"" item shall be available under View menu.","""Get New Themes"" item shall be available under View menu."
R-180,"""Classic"" item shall be available under View menu.","""Classic"" item shall be available under View menu."
R-181,"""Modern"" item shall be available under View menu.","""Modern"" item shall be available under View menu."
R-182,Browser toolbars shall be collapsed and expanded.,Browser toolbars shall be collapsed and expanded.
R-183,Folders shall be added to the personal toolbar and their contents shall still function as links.,Folders shall be added to the personal toolbar and their contents shall still function as links.
R-184,Browser navigation toolbar buttons shall execute appropriately.,Browser navigation toolbar buttons shall execute appropriately.