ID,Feature,Description
R-6,Add/Delete Personal Toolbar bookmark,"Verify that items from the personal toolbar folder are properly
      added/deleted."
R-7,Create Folder,Verify new folder creation and nesting of new folders.
R-14,Save State,Verify that changes are saved over restart/crash
R-15,View item properties,"Verify that view properties works as appropriate for bookmarks,
      folders, and separators(negative)"
R-16,Rename bookmark inline - not implemented,"Change the name of a bookmark without use of the bookmark properties
      dialog."
R-30,Prevent bad drops,"Verify that it is NOT possible to drop an item onto itself or its
      immediate parent or child"
R-33,Images,"Determine whether native and non-native images are correctly copied
      to the system Clipboard."
R-36,Overflow,"Determine whether extremely large images can be copied from web
      pages."
R-37,Stress,"Determine whether complicated rich text (such as massively nested
      tables) can be copied."
R-38,General,"Determine whether text can be copied and pasted from text fields
      within a dialog box."
R-40,General,"Determine whether HTML entities can be properly copied to other
      applications."
R-43,D&D Images across browser windows,"Verify that dragging an image across browser windows
      opens the image"
R-48,D&D from the desktop – Folders,"Confirm that dragging a directory
      to the browser window displays the folder contents"
R-50,D&D from the desktop – Text files,"Confirm that dragging a text file to the browser
      window displays the document contents"
R-54,D&D from Find File window,"Verify that items dragged from a
       Find File window are handled properly
       (Windows / Mac OS)"
R-57,D&D URL Proxy Icons onto the Desktop,"Verify that dragging the URL proxy icon
      onto the desktop creates a shortcut"
R-58,D&D from Bookmark Manager,"Determine if the application and OS properly
      handle items dragged from the Bookmark Manager"
R-63,Dragging links to AIM,"Verify that you can drag a URL or page content to
      an AIM window"
R-65,Form Manager - Pop-up,"Verify that a form fill popup menu is activated
      when a field gets accessed that has been saved in form
      manager data."
R-66,Form Manager - Permission Zones,"* Longer range:
      there is discussion about introducing Internet permission zones.
      Some of the settings shown here may be controlled by such zones
      (Waiting for Implementation)"
R-72,Save Form Data - never return,"Verify that you can save a form's data from the popup dialog
      box, never for this site and you are never asked again upon
      returning to the site."
R-77,Edit Form Data - cancel,"Verify that if you enter data in the Form Manager and then
      click cancel, the data has not been saved"
R-78,Delete Form Data - remove field value,"Verify that if you delete data in the Form Manager, that this
      data is not shown as an option when prefilling a form."
R-79,Delete Form Data - cancel,"Verify that if you delete data in the Form Manager then
      click cancel, the data has not been deleted"
R-81,Installation,"Verify that it is possible to install only the needed help files
        (for components that are actually installed)"
R-85,Index,"Verify that there is an in Index of help content and a list of
        keywords to links in the help content. (Verify the content is in local
        documents)"
R-86,Favorite,"Verify that is it is possible to have favorite help topics -
        similar to IE help which has a special tab to add favorite help
        topics."
R-88,TS/Sign on,"Verify that there is Troubleshooting Help about the problem ""if you
        can't sign on"""
R-90,TS/Buddy List,"Verify that there is Troubleshooting Help about the problme ""if you
        can't see anyone in your buddy list window."""
R-91,Glossary,"Verify that in the Glossary there includes a section on tips and
        tricks/tip of the day."
R-92,Glossary,"Verify that in the Glossary there includes a section for an
        Intro/tutorial for NS6."
R-98,Hide/Show toolbar,"Verify that you can hide the toolbar in help as well as reopen
        it"
R-101,Non Clickable Regions,"Verify that clicking non clickable regions in help causes no
        behavior"
R-111,Same time messaging,Determine whether Same time messaging displays correctly
R-116,Security Center,Determine whether the Security Center displays correctly
R-119,About,Determine whether the About Netscape displays correctly
R-121,Record sites,Verify that visited links are recorded.
R-123,Load recorded url,"Verify that double-clicking on a history link causes it to be
        launched in a browser window."
R-126,Erase all,Clear all of history
R-130,Resize columns,Verify that columns are resizable to show/hide more of entries
R-132,Don't record everything,"Verify that things that aren't supposed to be added to history
        aren't (eg chorme:/// url's)"
R-136,Surf Go menuitems,Verify browser goes back and forward to recently visited sites
R-139,Back and forward with named anchors,"Verify browser goes back and forward correctly from sites that use
        named anchors"
R-140,Retain scroll position,"Verify that browser remembers scroll state when returning to pages
        in SH"
R-142,Text and image resize,"Determine that you are not able to resize an image to window when
        there is also text on the page, this is a stand alone image feature
        only."
R-143,Resize to original,"Determine that it is possible to resize an image to it's original
        size after it has been resized to window size."
R-144,Resized to window,"Determine that after resizing an image to it's original size, it is
        possible to resize to window again."
R-152,Image Display,"Determine whether images load directly into the web browser from a
        local hard drive."
R-153,Image Display,"Determine whether animated GIFs continue to animate after an
        extended period of 24 hours or greater."
R-155,Animated Images,"Determine whether displaying animated GIFs result in single server
        request for the image, rather than additional requests upon each frame
        change."
R-157,Image Display,"Determine whether X Bitmap (XBM) format images can be displayed.Note: XBM will not be supported in the initial 5.0
          release."
R-160,Stress,"Determine whether the web brower gracefully deals with unusual,
        corrupted, or invalid GIF images."
R-161,Test applets in HTML tags,"Test applets within <embed>, <applet> and 
  <object> tags"
R-165,Replace Forgotten Master Password,"Verify that the process to replace a forgotten master password is
      easier/more discoverable (though encrypted information should still be
      lost to the user who has forgotten their password)."
R-167,"Save username and password, never for this site","Verify that the browser behaves correctly after selections are made
      in the save password dialog box"
R-169,"Activation, disable after saved","Verify that when the password manager has been disabled, it is no
      longer in use, even for passwords already saved"
R-190,Test Page,Print a test page and check to see if it prints properly
R-200,Top Web Sites,Determine if  top web sites print properly
R-205,Print Character Styles,Determine if character styles print correctly
R-206,Print Paragraph Styles,Determine if paragraph styles print correctly
R-208,Page Setup(mac only),Determine id Page Setup dialog works correctly
R-209,Off-Line Printing,Determine that off-line printing works
R-213,Realplayer tests,Determine if Realaudio works properly
R-214,Quicktime tests,Determine if quicktime movies play properly
R-215,Sound tests,Determine if files with various sound formats play properly
R-217,Acrobat Tests,Determine if Acrobat plugin works properly
R-220,Search button,Verify that just clicking Search button goes to search page
R-232,Shift Select,"Determine whether shift-select gestures for text function
        properly."
R-234,JavaScript,"Determine whether text from a JavaScript applet is properly
        selected in conjunction with other page content."
R-237,Constraints,Check for maximum width of Sidebar
R-244,Add/Remove,Delete a panel
R-250,Re-Order,Verify reordering of panels works
R-251,Cancel,Verify that nothing changes when you cancel
R-252,Save,Verify that order and panel list is immediately applied
R-255,Bookmarks,Verify that links in Bookmarks work
R-260,Basic access to dialog,Tests to access this dialog from the menubar and keyboard.
R-262,URL in current browser window,"Open a web location (URL) in the current Navigator window. Includes
        test to dismiss dialog."
R-265,URL autocompletion,"After viewing a file/page or three, test URL
        autocompletion: test for current browser, new browser and new editor
        windows."
R-267,Local file in current browser window,"Open local files (both HTML and plain text tested) in the current
        Navigator window. Includes tests to dismiss dialog."
R-269,Local file in an editor window,"Open local files (both HTML and plain text tested) in a Composer
        window. Includes tests to dismiss dialog."
R-270,Nonexistent local file,Open a nonexistent (bogus) local file.
R-271,URL to a image files,"Open web locations to various image files, such as.gif,.jpg."
R-273,Use on Win32,"Use of the native Win32 file picker to navigate through directories
        and open files (html, plaintext, image). Cancellation also tested."
R-274,Use on Mac OS,"Use of the native Mac OS file picker to navigate through
        directories and open files (html, plaintext, image). Cancellation also
        tested."
R-277,Basic find in page and frame content,"Find in html page and html frame documents. Test Find Again and
        cancellation. Test for NOFRAME content."
R-284,Basic access,"Access from main menu, keyboard accelerator, access keys."
R-290,Color coding,"Verify the expected displayed color for content, tags/attributes,
        values, script code, entities, etc."
R-298,Testing under Classic theme,Verify Classic theme works as advertised
R-299,Check the appearance of browser,"Visually inspect menu bar, floating component bar and all the
        tool bars"
R-300,Testing under Modern theme,Verify Modern theme works as advertised
R-302,Checking View menu,Verify if themes exist under View menu
R-304,"Verify all the selectable items on other applications under
        Classic theme","Click through all the items on menu bar and tool bars under AIM,
        Composer, Mail and Address book to see all the looks and feel are
        consistence under Classic theme"
R-306,"Verify all the selectable items on other applications under
        Modern theme","Click through all the items on menu bar and tool bars under AIM,
        Composer, Mail and Address book to see all the looks and feel are
        consistence under Modern theme"
R-308,Window Title,"Verify the title is correct, ""<page title> - Mozilla"""
R-309,Active/Inactive Window,"The active window is visually distinct, inactive = grey title
        bar."
R-315,Stretch Window Diagonally,"Grab any corner of window and drag to resize. Only bottom-right
        corner on Mac."
R-317,Scroll Arrow Down,Click down arrow to scroll page
R-323,Add a folder,"Verify that a folder added to the personal toolbar functions
        properly."
R-325,Correct items/links,Verify that the correct items are in the taskbar.
R-326,Component buttons,Verify that component buttons work and behave as appropriate.
