ID,Purpose,Test steps
1,Virtual and physical servers,Verify that the documentation describes how to install the application both in a physical and in a virtual environment
10,Database hosting,Verify that the system documentation describes the databases and database versions used.
21,Security log,Verify that all relevant information is logged in the security log
23,Log date and system time,Verify that all entries in the log contain the date and system time
29,Switching on and off and status of breakers from other GE system,Verify that switching on is not possible by integration from other system. Verify that switching off is not possible by integration from other system. Verify that status of switches is possible to see by integration.
32,Send the same info again,Receive same info from file. Receive same info from meter
33,Controlling logout time,Wait for 45 minutes.
84,Develop test cases,"The supplier shall prepare test cases based on agreed requirements, i.e. agreed Specification unless otherwise agreed."
86,Testing tools,The Contractor shall use a tool designated by the Contracting Authority to follow the Contracting Authority's reporting of test results. The Supplier is responsible for registering in the tool its feedback and status on the Customer's reported errors and comments. The Client currently uses ReQtest in the defect management process.
89,Test report,"The Contractor shall establish a test report for the test phases for which the Contractor is responsible during the Delivery Project, as shown in Figure 1 in clause 3.2."
100,Support under UAT,The supplier shall be present at the purchaser's premises and assist when the purchaser performs UAT.
141,Metering units in HES,"Verify that it is possible to install new Metering Unit - Cat 1, 1 phase. Verify that it is possible to install new Metering Unit - Cat 1, 3 phase. Verify that it is possible to install new Metering Unit - Cat 2. Replace meter type Cat 1, 1 phase. Replace meter type Cat 1, 3 phase. Replace meter type Cat 2. Take down meter type Cat 1, 1 phase. Take down meter type Cat 1, 3 phase. Take down meter type Cat 2"
143,Data in HES,"Verify that structure data can be handled in HES (e.g. Facility ID, Metering Unit). Verify that Metrics can be handled in HES (Metrics with e.g. ID number, status, timestamp). Verify that Events can be handled in HES (Event with e.g. Event ID, times, Alarms)"
149,Automatic collection of Measured values,Verify that the metering system can be configured for regular automatic collection of Measurement values from Metering Units to HES.
188,Exporting reports and data,"Verify that the retrieved measurement and structural data as well as the finished reports can be exported to any standardized text file format, such as csv."
194,Energy values to other system within 10 sec,Verify that the goods are delivered from HES according to the agreed export interval
216,Time interval for measured values,Verify that there is functionality to select different time intervals and time resolution for the Metrics presented.
218,Help function,Verify that there is a help function in the HES user interface that helps the User to understand how to perform tasks using the functionality of the system.
219,Setting the number of decimal places,Verify that it is possible to configure the number of decimal places to be displayed for a measurement value.
222,Events to alert list,"Reset the clock in the meter. Trigger self-diagnosis and generate a fault during the diagnosis itself. Disconnect the power on one phase. Disconnect the power on several phases. Connect production to the meter, and the measuring point in HES has a profile for consumption only. Unscrew a voltage fuse on the meter board so that an event is generated in the meter. Unscrew the 'zero' so that an event is generated in the meter. Use super magnet at the meter to cause an event in the meter. Set a low limit value in the meter. For both cat 1 and cat 2 - generate high current at meter to cause event. For both cat 1 and cat 2 - generate high power on meter to cause event. Generate overheating"
237,Detecting meters with communication problems,Verify that in HES it is possible for the User to detect and see individual Metering Units that have communication problems.
238,View last measurement value and time,Verify that the last Measured Value and the time of communication with the Metering Unit are displayed in HES. Verify that the last Measured Value and the time of communication with the Metering Unit are displayed in the HES.
247,Cumulative calculator,Verify that the metering unit is equipped with a cumulative counter and displays at least 7 integer digits and 3 decimal digits.
271,copy static fields,"Verify that it is possible to copy static fields in HES such as headers, status, responses to Events in the system."
273,Request further confirmation,"Verify that commands, initiated by the User in HES, which may have serious consequences in case of incorrect handling (deletion of stored measurement and structure data and switching off and on of power) require additional confirmation before being executed. Verify that commands which do not have serious consequences do not require additional confirmation before being executed."
279,Configuring the Metering Unit,Verify that configuration of the Metering Device from HES can be performed without downloading new Firmware.
293,Corrected measurement values,"Verify that the metering device corrects the measured values of voltage and/or current when calculating energy consumption, these values shall also be those used in the Metering System."
310,Measurement and recording / phase,"Verify that the Metering Unit for each phase is able to measure and record the minimum, maximum and average value of voltage, current, active and reactive power of the electricity output and input per 5 minutes."
327,Record when high power exceeds limit value per phase,"Verify that the Metering System is able to record and store information when the following Events occur:
14. High power exceeds set limit value per phase"
330,Register overheating in connection,"Verify that the Metering System is able to record and store information when the following Events occur:
17. In case of connection overheating"
331,Configure records to be stored for events,Verify that for each Event it is possible to optionally configure which registers (OBIS codes) in the Metering Unit should be stored.
332,Disable sending of Events from specific Metering Unit,Verify that it is possible to disable the sending of Events from the designated Metering Unit from HES in order not to have to receive a large amount of Events from a particular Metering Unit.
339,Communication status - Cat1 1 phase,"Verify that it is possible to view the communication status of the Metering Unit directly, without manual intervention and without opening the meter."
340,Communication status - Cat1 3 phase,"Verify that it is possible to view the communication status of the Metering Unit directly, without manual intervention and without opening the meter."
341,Communication status - Cat2,"Verify that it is possible to view the communication status of the Metering Unit directly, without manual intervention and without opening the meter."
352,Interpolation in HES,Verify that there is functionality in HES to perform interpolations where the collected value is missing.
364,PQ values to HES within 4h,Verify that the PQ values (15-minute values) can be delivered at the latest within 4 hours from the registration in the Metering Units to HES
404,View meters with communication problems in map,Verify that in HES it is possible to visualize Metering Units with communication problems in a graphical view/map that can be zoomed in and out.
430,Management of both primary and secondary registration - Cat2,Verify that the Metering Units can handle primary registration of Measured Values. Verify that the Metering Units can handle secondary registration of Measured Values.
432,Cat 2 shall meet the requirements for control,"Verify that Metering Units Category 2 meet the requirements for Inspection, according to Regulation STAFS 2009:8, for the first Inspection. However, only for a maximum of 12 years after Final Approval has been given by the Client."
434,minimum rated current 5A,Verify that the Metering Unit is rated for at least a current of 5 (Imax 100) A.
445,Resistant marking - Cat1,"Verify that the labeling of the Meter's manufacturing number is durable for the lifetime of the Meter, i.e. no removable tape or print that can be scraped off."
446,Resistant marking - Cat2,"Verify that the labeling of the Meter's manufacturing number is durable for the lifetime of the Meter, i.e. no removable tape or print that can be scraped off."
451,Location of the marking - Cat1,"Verify that the Meter's serial number is placed on a non-removable part (not connector cover, not Communication Module cover, etc.)."
452,Location of the label - Cat2,"Verify that the Meter's serial number is placed on a non-removable part (not connector cover, not Communication Module cover, etc.)."
465,screw anchors - Cat2,Verify that there are no elevations around the Metering Unit's screw attachments that limit the size of the screw head.
466,screw anchors - Cat1,Verify that there are no elevations around the Metering Unit's screw attachments that limit the size of the screw head.
467,mounting bracket - Cat1,Verify that there is a mounting bracket placed on the top of the metering unit for mounting.
468,mounting bracket - Cat2,Verify that there is a mounting bracket placed on the top of the metering unit for mounting.
478,Management of both primary and secondary registration - Cat1,Verify that the Metering Units can handle both primary and secondary recording of Metering Values.
479,Licensed telecommunications networks,Verify that the licensed telecommunications network complies with Ordinances and Regulations in accordance with PTSFS 2015:2 issued by PTS (Post- och Telestyrelsen).
480,Life expectancy of communication equipment - Cat1,Verify that communication equipment meets the life expectancy requirement of >=15 years from the date of delivery to GE.
486,Life expectancy of communication equipment - Cat2,Verify that communication equipment meets the life expectancy requirement of >=15 years from the date of delivery to GE.
489,Recovery time after communication breakdown max 60 min,Break the communication link from meter. Voltage is left in meter. Wait one hour and turn on the link again.
593,Automatic export of energy values,Wait until the time for export occurs.
594,Manual export of energy values,Start an export from HES.
596,logging of events,Verify in HES that the events and their attribute values can be displayed in an event list.
615,Setting the number of decimal places,Verify that the number of decimal places displayed corresponds to the number of decimal places configured to be displayed for a measurement value. Verify that the number of decimal places displayed corresponds to the number of decimal places configured to be displayed for a measurement value.
616,Installation of new metering device via integration,Information regarding structure data for new set-up is sent from the integration interface Mint to Collection Manager. Verify that information entered on the user point in Collection Manager corresponds to what is specified in the Work Order. An acknowledgment is sent to Generis that the meter is set up in Collection Manager. Check that the user point is displayed under the correct coordinates in the map view in Vision. Check that the meter has the correct profile and that Energy values. PQ values and GSM diagnostics are pushed from the meter at the correct interval.
618,Dismantling of metering unit via integration,Information regarding the structure data for the removal of a metering unit is sent from the integration interface Mint to Collection Manager. Verify that the metering unit is removed in Collection Manager and does not have a connection to the user point.
619,Update of measurement point in CM,Information regarding the structure data for updating a metering unit is sent from the integration interface Mint to Collection Manager. Verify that the information to be updated via Mint has also been changed at the current user point.
620,New Metering Unit is set up in CM and taken down in ACM - Take down fails in ACM,Initiate a new set-up of a metering unit in CM and ensure that the metering unit is still in ACM when the new set-up is carried out in CM. A message is sent from CM to Generis stating that the metering unit in ACM is not taken down.
621,New Metering Unit is set up in CM and taken down in AiMiR - Take down fails in AiMiR,Initiate a new set-up of a metering unit in CM and ensure that the metering unit remains in AiMiR when the new set-up is carried out in CM. Mail is sent to the AiMir box.
622,New Metering Unit is set up in CM and taken down in ACM - Set-up fails in CM,Initiate a new set-up of a metering unit in CM and make sure that the metering unit is already connected to another facility in CM. Message is sent from CM to Generis stating that the metering unit is not created in CM.
623,New Metering Unit is set up in CM and taken down in AiMiR - Set-up fails in CM,Initiate a new set-up of a metering unit in CM and ensure that the metering unit is still in AiMir when the new set-up is carried out in CM. A message is sent from CM to Generis stating that the metering unit has not been created in CM.
624,Existing Metering Unit is changed in CM - Meter change fails in CM,Initiate a meter change of an existing metering unit in CM to a New Metering Unit. Enter incorrect serial number for the existing meter in the Work Order. Message is sent from CM to Generis stating that the metering unit is not created in CM. Verify the status of the work order in Generis.
625,New metering unit set up in CM - Set up fails in CM,Initiate new installation of a metering unit in CM. Enter a serial number for the metering unit already connected to an installation in the work order. Message is sent from CM to Generis stating that the metering unit is not created in CM. Verify the status of the work order in Generis.
626,Metering unit is taken down in CM - Take-down fails in CM,Initiate a removal of a metering unit in CM where mandatory information in the work order is not complete. Message is sent from CM to Generis stating that the metering unit is not removed in CM. Verify the status of the work order in Generis.
653,Common Information Model (CIM),Examine the content of the messages from HES.
