ID,Purpose,Test steps
10,Database hosting,Verify that the system documentation describes the databases and database versions used.
21,Security log,Verify that all relevant information is logged in the security log
23,Log date and system time,Verify that all entries in the log contain the date and system time
29,Switching on and off and status of breakers from other GE system,Verify that switching on is not possible by integration from other system. Verify that switching off is not possible by integration from other system. Verify that status of switches is possible to see by integration.
35,Traceable metering devices,Kamstrup demonstrates how components can be traced to batch and time of manufacture
56,Web service calls,Run the export of data.
71,Grid snapshot - Default values,Provoke an overvoltage on one of the meter's phases and verify that events are sent instantaneously to HES. Verify that the correct register (OBIS codes) is associated with the event. Verify that the Optical Eye shows the grid snapshot for the power misdirection event. Verify that the Optical Eye shows the grid snapshot for the voltage rise event
87,The client's test case,The customer shall have the right to develop own and new test cases based on the Specification. New test cases can be created until Final Acceptance of the Delivery Project.
90,Content of the test report,"The test report shall contain at least:
-Test cases executed 
-Results of the tests 
-Residual errors, if any 
-Residual test cases, if any 
-Suggested actions"
96,Retesting after modifications,The supplier shall also report possible consequences and impact on other functions from modifications made. The purchaser has the right to require repetition of the tests made in FAT if such modifications are made.
99,Training for UAT,The Contractor shall carry out the necessary training and submit the relevant documentation according to point 5 before the start of the Customer's UAT.
100,Support under UAT,The supplier shall be present at the purchaser's premises and assist when the purchaser performs UAT.
101,Requirements for delivery and installation in the production environment,"The Supplier shall during installation and commissioning of the Metering System in the Customer's production environment:
-install,
-if applicable configure/parameterize,
-if applicable migrate structure data,
-commission,
-verify and test the Metering System including integrations in the production environment, and 
-perform error corrections and retests"
141,Metering units in HES,"Verify that it is possible to install new Metering Unit - Cat 1, 1 phase. Verify that it is possible to install new Metering Unit - Cat 1, 3 phase. Verify that it is possible to install new Metering Unit - Cat 2. Replace meter type Cat 1, 1 phase. Replace meter type Cat 1, 3 phase. Replace meter type Cat 2. Take down meter type Cat 1, 1 phase. Take down meter type Cat 1, 3 phase. Take down meter type Cat 2"
143,Data in HES,"Verify that structure data can be handled in HES (e.g. Facility ID, Metering Unit). Verify that Metrics can be handled in HES (Metrics with e.g. ID number, status, timestamp). Verify that Events can be handled in HES (Event with e.g. Event ID, times, Alarms)"
149,Automatic collection of Measured values,Verify that the metering system can be configured for regular automatic collection of Measurement values from Metering Units to HES.
188,Exporting reports and data,"Verify that the retrieved measurement and structural data as well as the finished reports can be exported to any standardized text file format, such as csv."
194,Energy values to other system within 10 sec,Verify that the goods are delivered from HES according to the agreed export interval
218,Help function,Verify that there is a help function in the HES user interface that helps the User to understand how to perform tasks using the functionality of the system.
219,Setting the number of decimal places,Verify that it is possible to configure the number of decimal places to be displayed for a measurement value.
220,Recording of measurement value,"Verify that the measured value recorded and stored in the HES is uncorrupted, i.e. exactly the same value as recorded by the Metering Unit.
Request a timestamped measurement value from the Meter and compare what is displayed on the Meter with the information coming into the HES."
222,Events to alert list,"Reset the clock in the meter. Trigger self-diagnosis and generate a fault during the diagnosis itself. Disconnect the power on one phase. Disconnect the power on several phases. Connect production to the meter, and the measuring point in HES has a profile for consumption only. Unscrew a voltage fuse on the meter board so that an event is generated in the meter. Unscrew the 'zero' so that an event is generated in the meter. Use super magnet at the meter to cause an event in the meter. Set a low limit value in the meter. For both cat 1 and cat 2 - generate high current at meter to cause event. For both cat 1 and cat 2 - generate high power on meter to cause event. Generate overheating"
237,Detecting meters with communication problems,Verify that in HES it is possible for the User to detect and see individual Metering Units that have communication problems.
247,Cumulative calculator,Verify that the metering unit is equipped with a cumulative counter and displays at least 7 integer digits and 3 decimal digits.
251,Correct meter setting,"Verify that the Meter Reading on the Metering Unit always matches the numerical capacity of the collected Energy Value and the display, even if the Meter Readings have rolled over."
271,copy static fields,"Verify that it is possible to copy static fields in HES such as headers, status, responses to Events in the system."
279,Configuring the Metering Unit,Verify that configuration of the Metering Device from HES can be performed without downloading new Firmware.
293,Corrected measurement values,"Verify that the metering device corrects the measured values of voltage and/or current when calculating energy consumption, these values shall also be those used in the Metering System."
302,Possible overheating - Cat1 1 phase,Verify that the metering device has the capability to detect connections that may cause overheating.
303,Possible overheating - Cat1 3 phase,Verify that the metering device has the capability to detect connections that may cause overheating.
304,Possible overheating - Cat2,Verify that the metering device has the capability to detect connections that may cause overheating.
310,Measurement and recording / phase,"Verify that the Metering Unit for each phase is able to measure and record the minimum, maximum and average value of voltage, current, active and reactive power of the electricity output and input per 5 minutes."
319,Record communication errors,"Verify that the Metering System is able to record and store information when the following Events occur:
8. communication failure"
332,Disable sending of Events from specific Metering Unit,Verify that it is possible to disable the sending of Events from the designated Metering Unit from HES in order not to have to receive a large amount of Events from a particular Metering Unit.
339,Communication status - Cat1 1 phase,"Verify that it is possible to view the communication status of the Metering Unit directly, without manual intervention and without opening the meter."
340,Communication status - Cat1 3 phase,"Verify that it is possible to view the communication status of the Metering Unit directly, without manual intervention and without opening the meter."
341,Communication status - Cat2,"Verify that it is possible to view the communication status of the Metering Unit directly, without manual intervention and without opening the meter."
360,Block switches from HES,"For Cat1 - 1 phase meters, verify that the Meter breaker can be blocked from HES to prevent local connection. For Cat1 - 3 phase meters, verify that the Meter breaker can be blocked from HES to prevent local connection. For Cat2 meters, verify that the Meter breaker cannot be blocked from HES to prevent local connection."
362,Energy values to HES within 2h,Verify that the Energy values (15-minute values) are delivered to HES within 2 hours from registration in the Metering Unit.
404,View meters with communication problems in map,Verify that in HES it is possible to visualize Metering Units with communication problems in a graphical view/map that can be zoomed in and out.
406,Legal requirements,"Kamstrup shows how they fulfill:
1. Ellag SFS 1997:857.
2. The Ordinance (SFS 1999:716) on metering, calculation and reporting of transmitted electricity.
3. EIFS 2016:2 - The Swedish Energy Markets Inspectorate's Regulations and General Advice on Metering, Calculation and Reporting of Transmitted Electricity.
4. STAFS 2016:1 - Swedac's Regulations on Measuring Instruments.
5. STAFS 2016:4 - Swedac's Regulations and general guidelines on meters for active electrical energy.
6. STAFS 2009:8 - Swedac's Regulations and general advice on metering systems for the measurement of transmitted electricity.
7. STAFS 2009:9 - Swedac's Regulations and general advice on periodic inspection of meters for active electrical energy.
8. EU MID Directive 2014/32/EU.
9. Extended type approval and certification of Category 1 and 2 meters according to method SPM 1618, test with 12kV surge voltage.
10. Standards: SS-EN61869-1, SS-EN61869-2, SS-EN50470 and IEC 62056 (DLMS/COSEM suite).
11. EU Regulation 2016/679 of 27 April 2016 on the protection of natural persons with regard to the processing of personal data and on the free movement of such data, and repealing Directive 95/46/EC (General Data Protection Regulation).
12. EU Declaration of Conformity shall be provided for the Metering System if it or parts thereof are manufactured in a country outside the EU.
13. Law (2003:389) on electronic communication."
414,type approval - Cat1,"Verify that the Extended Type Approval and Certification of Metering Units is carried out according to method SPM 1618, test with 12 kV surge voltage."
415,type approval - Cat2,"Verify that the Extended Type Approval and Certification of Metering Units is carried out according to method SPM 1618, test with 12 kV surge voltage."
432,Cat 2 shall meet the requirements for control,"Verify that Metering Units Category 2 meet the requirements for Inspection, according to Regulation STAFS 2009:8, for the first Inspection. However, only for a maximum of 12 years after Final Approval has been given by the Client."
441,Visible manufacturing number - communication module - Cat1,Verify that a serial number on a Communication Module is positioned so that it is not visible on the front of the Metering Unit.
442,Visible manufacturing number - communication module - Cat2,Verify that a serial number on a Communication Module is positioned so that it is not visible on the front of the Metering Unit.
447,Legible marking - Cat1,"Verify that the marking of the meter's manufacturing number is clearly legible
- i.e. the font size must not be too small so that the number is difficult to read e.g. for a customer"
448,Legible marking - Cat2,"Verify that the marking of the meter's manufacturing number is clearly legible
- i.e. the font size must not be too small so that the number is difficult to read e.g. for a customer"
451,Location of the marking - Cat1,"Verify that the Meter's serial number is placed on a non-removable part (not connector cover, not Communication Module cover, etc.)."
452,Location of the label - Cat2,"Verify that the Meter's serial number is placed on a non-removable part (not connector cover, not Communication Module cover, etc.)."
463,Terminal block - Cat1,Verify that the Metering Unit has terminal covers that cover the connection cable layer.
464,Terminal block - Cat2,Verify that the Metering Unit has terminal covers that cover the connection cable layer.
467,mounting bracket - Cat1,Verify that there is a mounting bracket placed on the top of the metering unit for mounting.
468,mounting bracket - Cat2,Verify that there is a mounting bracket placed on the top of the metering unit for mounting.
471,sealing device - Cat1,Verify that the sealing device of the Metering Unit is raised and clearly visible for smooth and accessible passage of the sealing wire.
472,sealing device - Cat2,Verify that the sealing device of the Metering Unit is raised and clearly visible for smooth and accessible passage of the sealing wire.
479,Licensed telecommunications networks,Verify that the licensed telecommunications network complies with Ordinances and Regulations in accordance with PTSFS 2015:2 issued by PTS (Post- och Telestyrelsen).
480,Life expectancy of communication equipment - Cat1,Verify that communication equipment meets the life expectancy requirement of >=15 years from the date of delivery to GE.
486,Life expectancy of communication equipment - Cat2,Verify that communication equipment meets the life expectancy requirement of >=15 years from the date of delivery to GE.
489,Recovery time after communication breakdown max 60 min,Break the communication link from meter. Voltage is left in meter. Wait one hour and turn on the link again.
491,Design of the solution,Review installed solution and compare with requirements in 2.1 Technical solution.
615,Setting the number of decimal places,Verify that the number of decimal places displayed corresponds to the number of decimal places configured to be displayed for a measurement value. Verify that the number of decimal places displayed corresponds to the number of decimal places configured to be displayed for a measurement value.
616,Installation of new metering device via integration,Information regarding structure data for new set-up is sent from the integration interface Mint to Collection Manager. Verify that information entered on the user point in Collection Manager corresponds to what is specified in the Work Order. An acknowledgment is sent to Generis that the meter is set up in Collection Manager. Check that the user point is displayed under the correct coordinates in the map view in Vision. Check that the meter has the correct profile and that Energy values. PQ values and GSM diagnostics are pushed from the meter at the correct interval.
618,Dismantling of metering unit via integration,Information regarding the structure data for the removal of a metering unit is sent from the integration interface Mint to Collection Manager. Verify that the metering unit is removed in Collection Manager and does not have a connection to the user point.
619,Update of measurement point in CM,Information regarding the structure data for updating a metering unit is sent from the integration interface Mint to Collection Manager. Verify that the information to be updated via Mint has also been changed at the current user point.
620,New Metering Unit is set up in CM and taken down in ACM - Take down fails in ACM,Initiate a new set-up of a metering unit in CM and ensure that the metering unit is still in ACM when the new set-up is carried out in CM. A message is sent from CM to Generis stating that the metering unit in ACM is not taken down.
621,New Metering Unit is set up in CM and taken down in AiMiR - Take down fails in AiMiR,Initiate a new set-up of a metering unit in CM and ensure that the metering unit remains in AiMiR when the new set-up is carried out in CM. Mail is sent to the AiMir box.
622,New Metering Unit is set up in CM and taken down in ACM - Set-up fails in CM,Initiate a new set-up of a metering unit in CM and make sure that the metering unit is already connected to another facility in CM. Message is sent from CM to Generis stating that the metering unit is not created in CM.
623,New Metering Unit is set up in CM and taken down in AiMiR - Set-up fails in CM,Initiate a new set-up of a metering unit in CM and ensure that the metering unit is still in AiMir when the new set-up is carried out in CM. A message is sent from CM to Generis stating that the metering unit has not been created in CM.
624,Existing Metering Unit is changed in CM - Meter change fails in CM,Initiate a meter change of an existing metering unit in CM to a New Metering Unit. Enter incorrect serial number for the existing meter in the Work Order. Message is sent from CM to Generis stating that the metering unit is not created in CM. Verify the status of the work order in Generis.
625,New metering unit set up in CM - Set up fails in CM,Initiate new installation of a metering unit in CM. Enter a serial number for the metering unit already connected to an installation in the work order. Message is sent from CM to Generis stating that the metering unit is not created in CM. Verify the status of the work order in Generis.
626,Metering unit is taken down in CM - Take-down fails in CM,Initiate a removal of a metering unit in CM where mandatory information in the work order is not complete. Message is sent from CM to Generis stating that the metering unit is not removed in CM. Verify the status of the work order in Generis.
653,Common Information Model (CIM),Examine the content of the messages from HES.
