ID,Feature,Description
S1,Legal requirements,"Laws, Regulations and standards applicable at the time of signing the contract with regard to function and safety shall be fulfilled for all parts of the Measuring System in accordance with points 1-13 below.
1. Ellag SFS 1997:857.
2. The Ordinance (SFS 1999:716) on metering, calculation and reporting of transmitted electricity.
3. EIFS 2016:2 - The Swedish Energy Markets Inspectorate's Regulations and General Advice on Metering, Calculation and Reporting of Transmitted Electricity.
4. STAFS 2016:1 - Swedac's Regulations on measuring instruments.
5. STAFS 2016:4 - Swedac's Regulations and general guidelines on meters for active electrical energy.
6. STAFS 2009:8 - Swedac's Regulations and general advice on metering systems for the measurement of transmitted electricity.
7. STAFS 2009:9 - Swedac's Regulations and general advice on periodic inspection of meters for active electrical energy.
8. EU MID Directive 2014/32/EU.
9. Extended type approval and certification of Category 1 and 2 meters according to method SPM 1618, test with 12kV surge voltage.
10. Standards: SS-EN61869-1, SS-EN61869-2, SS-EN50470 and IEC 62056 (DLMS/COSEM suite).
11. EU Regulation 2016/679 of 27 April 2016 on the protection of natural persons with regard to the processing of personal data and on the free movement of such data, and repealing Directive 95/46/EC (General Data Protection Regulation).
12. The EU Declaration of Conformity shall be available for the Metering System if it or parts thereof are manufactured in a country outside the EU.
13. Law (2003:389) on electronic communications."
S2,Traceable metering devices,"All delivered metering devices, down to component level, shall be traceable and can be linked at least to the manufacturing batch and time of manufacture"
S8,Block switches from HES,The meter switch shall be capable of being blocked from the HES to prevent local switching on of the power.
S12,PQ values to HES within 4h,The PQ values (15-minute values) shall be delivered at the latest within 4 hours from registration in the Metering Units to HES
S24,Operation of the metering unit after phase loss,The metering unit in a 3-phase installation shall continue to function even if one or two phases are lost.
S56,Customer interface is disabled by default,"On delivery from the factory, the Customer Interface of the Metering Unit shall be deactivated."
S58,Cumulative calculator,The metering unit shall be equipped with a cumulative counter and display at least 7 integer digits and 3 decimal digits.
S59,Metering unit display,"The display of the metering unit shall be able to show for each phase the instantaneous value of voltage, current, power for the output and input of electricity."
S70,Visible production number - communication module,A serial number on a Communication Module shall be positioned so that it is not visible on the front of the Metering Unit.
S77,Designed for wall mounting,The metering units shall be designed for wall mounting.
S81,Plinth cap,The metering unit shall have a terminal cover that covers the connection cable layer.
S86,Management of both primary and secondary registration,"The metering units shall be able to handle both primary and secondary registration of Metrics,"
S111,Exporting reports and data,"Retrieved measurement and structural data as well as completed reports shall be exportable to any standardized text file format, such as csv."
S116,Scaling of environment,HES shall be scalable so that the required performance can be maintained with increased data volumes.
S117,50 simultaneous users,The HES in the production environment shall be designed for at least 50 simultaneous Users without affecting the performance of the Metering System.
S119,Energy values are exported within 30 sec,The energy values (15-minute values) shall be exportable from HES via integrations to other systems within 30 seconds after registration in HES
S136,Setting the number of decimal places,"In the HES user interface, it shall be possible to set the number of decimal places to be displayed for a Metric Value."
S137,Recording of Metric value,"The metric value recorded and stored in the HES shall be unadulterated, i.e. exactly the same value as recorded by the Metering Unit."
S139,Events to alert list,Events configured to generate Alarms shall be displayed in an Alarm List.
S143,logging of events,Events in the Metering System shall be logged in an event list in HES.
S163,Request further confirmation,"Commands, initiated by the User in HES, which may have serious consequences in case of incorrect handling (deletion of stored measurement and structure data and disconnection and reconnection of power) shall require additional confirmation before execution"
S171,Connection and disconnection of breakers from other GE systems,The HES shall be able to receive calls from other business systems within GE for connection and disconnection of customer facilities via the Metering Unit's switch.
S177,Interpolation in HES,There should be functionality in HES to perform interpolations where the collected value is missing.
S186,Recovery time after communication breakdown max 60 min,The recovery time of the infrastructure communication after a communication breakdown shall not exceed 60 minutes.
S213,Web service calls,HES shall be able to make and receive web service calls.
S236,Log date and system time,The date and system time shall be recorded for each logged record.
S259,Dependencies with other systems,Solution design should be such that dependencies on other systems do not cause the system to lose protection.
B1,Corrected measurement values,"If the Metering Unit corrects measured values of voltage and/or current when calculating energy consumption, these values shall also be those used in the Metering System."
B24,Record communication errors,"The metering system shall record and store information when the following Events occur:
8. communication failure"
B31,Record when power output exceeds limit value,"The metering system shall record and store information when the following Events occur:
15. Total power consumption exceeds the set limit value"
B34,Configure records to be stored for events,"For each Event, it shall be possible to optionally configure which registers (OBIS codes) in the Metering Unit are to be stored."
B42,Communication status,"It shall be possible to view the communication status of the Metering Unit directly, without manual intervention and without opening the meter."
B45,screw anchors,There shall be no protrusions around the screw fixings of the metering unit that limit the size of the screw head.
B48,sealing device,The sealing device of the metering unit shall be raised and clearly visible for easy and accessible insertion of the sealing wire.
B53,minimum rated current 5A,The metering unit shall be rated for a minimum current of 5 (Imax 100) A.
B61,Response times in the user interface,"Response times in the HES user interface shall not exceed:
- 0.5 sec from input, keystroke or equivalent to first response on screen
- 0.5 sec for display of form view including data
- 5 sec for display of simple report
- 15 sec for login"
B71,Help function,The HES user interface shall (LB71) include a help function to assist the User in understanding how to perform tasks using the functionality of the system.
B81,Detecting meters with communication problems,"In HES, it shall be possible for the User to detect and view individual Metering Units that have communication problems."
B83,View meters with communication problems in map,"In HES, it should be possible to visualize Metering Units with communication problems in a graphical view/map that can be zoomed in and out."
B87,copy static fields,"It shall be possible for the User to be able to copy static fields in HES such as headers, status, responses to Events in the system."
B89,Request further confirmation,"Commands, initiated by the User in HES, which may have serious consequences in case of incorrect handling (deletion of stored measurement and structure data and switching off and on of power) shall require additional confirmation before execution. Other commands shall be executed directly."
B90,Mass deletion,"In HES, there shall be a function to perform mass deletion of overall structure data objects so that all linked relations are also deleted. E.g. that this is implemented via group membership."
B93,Create groups,"Groups should be able to be created dynamically by the User in HES using different parameters, e.g. Facility ID for export of collected data or upgrade of the meter's software where group can be by postal code or meter identity."
B106,Hardware for the user interface,"HES should be designed to work with different types of computers, tablets and smartphones, with different architectures and operating systems."
S543,Develop test cases,"The supplier shall prepare test cases based on agreed requirements, i.e. agreed Specification unless otherwise agreed."
S545,Testing tools,The Contractor shall use a tool designated by the Contracting Authority to follow the Contracting Authority's reporting of test results. The Contractor is responsible for registering its feedback and the status of the Client's reported errors and comments in the tool. The Client currently uses ReQtest in the defect management process.
S557,Scope of UAT,The purchaser's UAT (User Acceptance Test) shall include testing and verification of all requirements according to the Specification unless otherwise agreed.
S558,Training for UAT,The Contractor shall carry out the necessary training and submit the relevant documentation in accordance with Clause 5 prior to the commencement of the Purchaser's UAT.
S559,Support under UAT,The Supplier shall be present at the Purchaser's premises and assist the Purchaser in carrying out the UAT.
S560,Requirements for delivery and installation in the production environment,"During installation and commissioning of the Metering System in the Customer's production environment, the Supplier shall: 
-install, 
-if necessary configure/parameterize, 
-if necessary migrate structural data, 
-commission, 
-verify and test the Metering System including integrations in the production environment, and 
-perform error corrections and retests"
