ID,Purpose,Test steps
21,Security log,Verify that all relevant information is logged in the security log
23,Log date and system time,Verify that all entries in the log contain the date and system time
29,Switching on and off and status of breakers from other GE system,Verify that switching on is not possible by integration from other system. Verify that switching off is not possible by integration from other system. Verify that status of switches is possible to see by integration.
35,Traceable metering devices,Kamstrup demonstrates how components can be traced to batch and time of manufacture
43,Function of the metering unit after loss of phases on Cat1,Remove voltage on two of three phases
44,Function of the metering unit after phase loss on Cat2,Remove voltage on two of three phases
49,Scaling of environment,Measure performance during normal reporting operation. Increase CPU & RAM in clusters. Measure performance.
50,50 simultaneous users,"Run operations with a logged-in user. For example, searches and exports. Measure response times in the web interface. Run the same operations with 50 concurrent users. Measure response times in the web interface."
56,Web service calls,Run the export of data.
78,Dependencies with other systems,"For example, turn off the connection between Collection Manager and OMNIA Flex."
84,Develop test cases,"The supplier shall prepare test cases based on agreed requirements, i.e. agreed Specification unless otherwise agreed."
86,Testing tools,The Contractor shall use a tool designated by the Contracting Authority to follow the Contracting Authority's reporting of test results. The Supplier is responsible for registering in the tool its feedback and status on the Customer's reported errors and comments. The Client currently uses ReQtest in the defect management process.
98,Scope of UAT,The purchaser's UAT (User Acceptance Test) shall include testing and verification of all requirements of the Specification unless otherwise agreed.
99,Training for UAT,The Contractor shall carry out the necessary training and submit the relevant documentation according to point 5 before the start of the Customer's UAT.
100,Support under UAT,The supplier shall be present at the purchaser's premises and assist when the purchaser performs UAT.
101,Requirements for delivery and installation in the production environment,"The Supplier shall during installation and commissioning of the Metering System in the Customer's production environment:
-install,
-if applicable configure/parameterize,
-if applicable migrate structure data,
-commission,
-verify and test the Metering System including integrations in the production environment, and 
-perform error corrections and retests"
188,Exporting reports and data,"Verify that the retrieved measurement and structural data as well as the finished reports can be exported to any standardized text file format, such as csv."
218,Help function,Verify that there is a help function in the HES user interface that helps the User to understand how to perform tasks using the functionality of the system.
219,Setting the number of decimal places,Verify that it is possible to configure the number of decimal places to be displayed for a measurement value.
220,Recording of measurement value,"Verify that the measured value recorded and stored in the HES is uncorrupted, i.e. exactly the same value as recorded by the Metering Unit.
Request a timestamped measurement value from the Meter and compare what is displayed on the Meter with the information coming into the HES."
222,Events to alert list,"Reset the clock in the meter. Trigger self-diagnosis and generate a fault during the diagnosis itself. Disconnect the power on one phase. Disconnect the power on several phases. Connect production to the meter, and the measuring point in HES has a profile for consumption only. Unscrew a voltage fuse on the meter board so that an event is generated in the meter. Unscrew the 'zero' so that an event is generated in the meter. Use super magnet at the meter to cause an event in the meter. Set a low limit value in the meter. For both cat 1 and cat 2 - generate high current at meter to cause event. For both cat 1 and cat 2 - generate high power on meter to cause event. Generate overheating"
237,Detecting meters with communication problems,Verify that in HES it is possible for the User to detect and see individual Metering Units that have communication problems.
245,Customer interface is disabled by default,"Verify that on delivery from the factory, the Customer Interface of the Metering Unit is deactivated."
247,Cumulative calculator,Verify that the metering unit is equipped with a cumulative counter and displays at least 7 integer digits and 3 decimal digits.
248,Metering unit display - Cat1 1 phase,Verify that the display of the Metering Unit for each phase can show the instantaneous value of voltage. Verify that the display of the Metering Unit for each phase can show the instantaneous value of current. Verify that the display of the Metering Unit for each phase can show the instantaneous value of power for the extraction and input of electricity.
249,Metering unit display - Cat1 3 phase,Verify that the display of the Metering Unit for each phase can show the instantaneous value of voltage. Verify that the display of the Metering Unit for each phase can show the instantaneous value of current. Verify that the display of the Metering Unit for each phase can show the instantaneous value of power for the extraction and input of electricity.
250,Metering unit display - Cat2,Verify that the display of the Metering Unit for each phase can show the instantaneous value of voltage. Verify that the display of the Metering Unit for each phase can show the instantaneous value of current. Verify that the display of the Metering Unit for each phase can show the instantaneous value of power for the extraction and input of electricity.
271,copy static fields,"Verify that it is possible to copy static fields in HES such as headers, status, responses to Events in the system."
273,Request further confirmation,"Verify that commands, initiated by the User in HES, which may have serious consequences in case of incorrect handling (deletion of stored measurement and structure data and switching off and on of power) require additional confirmation before being executed. Verify that commands which do not have serious consequences do not require additional confirmation before being executed."
274,Mass deletion,Verify that in HES there is a function to perform mass deletion of overall structure data objects so that all linked relations are also deleted. E.g. that this is implemented via group membership.
281,Create groups,"Verify that groups can be created dynamically by the User in HES using different parameters, e.g. Facility ID for export of collected data or meter software upgrade where group can be by postcode or meter identity."
293,Corrected measurement values,"Verify that the metering device corrects the measured values of voltage and/or current when calculating energy consumption, these values shall also be those used in the Metering System."
319,Record communication errors,"Verify that the Metering System is able to record and store information when the following Events occur:
8. communication failure"
328,Record when power output exceeds limit value,"Verify that the Metering System is able to record and store information when the following Events occur:
15. Total power consumption exceeds set limit value"
331,Configure records to be stored for events,Verify that for each Event it is possible to optionally configure which registers (OBIS codes) in the Metering Unit should be stored.
339,Communication status - Cat1 1 phase,"Verify that it is possible to view the communication status of the Metering Unit directly, without manual intervention and without opening the meter."
340,Communication status - Cat1 3 phase,"Verify that it is possible to view the communication status of the Metering Unit directly, without manual intervention and without opening the meter."
341,Communication status - Cat2,"Verify that it is possible to view the communication status of the Metering Unit directly, without manual intervention and without opening the meter."
352,Interpolation in HES,Verify that there is functionality in HES to perform interpolations where the collected value is missing.
358,Response times in the user interface,"Verify that HES user interface response times do not exceed:
- 0.5 s from input, keystroke or equivalent to first response on screen
- 0.5 s for display of form view including data
- 5 s for viewing simple report
- 15 s for login"
360,Block switches from HES,"For Cat1 - 1 phase meters, verify that the Meter breaker can be blocked from HES to prevent local connection. For Cat1 - 3 phase meters, verify that the Meter breaker can be blocked from HES to prevent local connection. For Cat2 meters, verify that the Meter breaker cannot be blocked from HES to prevent local connection."
364,PQ values to HES within 4h,Verify that the PQ values (15-minute values) can be delivered at the latest within 4 hours from the registration in the Metering Units to HES
404,View meters with communication problems in map,Verify that in HES it is possible to visualize Metering Units with communication problems in a graphical view/map that can be zoomed in and out.
406,Legal requirements,"Kamstrup shows how they fulfill:
1. Ellag SFS 1997:857.
2. The Ordinance (SFS 1999:716) on metering, calculation and reporting of transmitted electricity.
3. EIFS 2016:2 - The Swedish Energy Markets Inspectorate's Regulations and General Advice on Metering, Calculation and Reporting of Transmitted Electricity.
4. STAFS 2016:1 - Swedac's Regulations on Measuring Instruments.
5. STAFS 2016:4 - Swedac's Regulations and general guidelines on meters for active electrical energy.
6. STAFS 2009:8 - Swedac's Regulations and general advice on metering systems for the measurement of transmitted electricity.
7. STAFS 2009:9 - Swedac's Regulations and general advice on periodic inspection of meters for active electrical energy.
8. EU MID Directive 2014/32/EU.
9. Extended type approval and certification of Category 1 and 2 meters according to method SPM 1618, test with 12kV surge voltage.
10. Standards: SS-EN61869-1, SS-EN61869-2, SS-EN50470 and IEC 62056 (DLMS/COSEM suite).
11. EU Regulation 2016/679 of 27 April 2016 on the protection of natural persons with regard to the processing of personal data and on the free movement of such data, and repealing Directive 95/46/EC (General Data Protection Regulation).
12. EU Declaration of Conformity shall be provided for the Metering System if it or parts thereof are manufactured in a country outside the EU.
13. Law (2003:389) on electronic communication."
430,Management of both primary and secondary registration - Cat2,Verify that the Metering Units can handle primary registration of Measured Values. Verify that the Metering Units can handle secondary registration of Measured Values.
434,minimum rated current 5A,Verify that the Metering Unit is rated for at least a current of 5 (Imax 100) A.
441,Visible manufacturing number - communication module - Cat1,Verify that a serial number on a Communication Module is positioned so that it is not visible on the front of the Metering Unit.
442,Visible manufacturing number - communication module - Cat2,Verify that a serial number on a Communication Module is positioned so that it is not visible on the front of the Metering Unit.
455,Designed for wall mounting - Cat1,Verify that the Metering Units are designed for wall mounting.
456,Designed for wall mounting - Cat2,Verify that the Metering Units are designed for wall mounting.
463,Terminal block - Cat1,Verify that the Metering Unit has terminal covers that cover the connection cable layer.
464,Terminal block - Cat2,Verify that the Metering Unit has terminal covers that cover the connection cable layer.
465,screw anchors - Cat2,Verify that there are no elevations around the Metering Unit's screw attachments that limit the size of the screw head.
466,screw anchors - Cat1,Verify that there are no elevations around the Metering Unit's screw attachments that limit the size of the screw head.
471,sealing device - Cat1,Verify that the sealing device of the Metering Unit is raised and clearly visible for smooth and accessible passage of the sealing wire.
472,sealing device - Cat2,Verify that the sealing device of the Metering Unit is raised and clearly visible for smooth and accessible passage of the sealing wire.
478,Management of both primary and secondary registration - Cat1,Verify that the Metering Units can handle both primary and secondary recording of Metering Values.
489,Recovery time after communication breakdown max 60 min,Break the communication link from meter. Voltage is left in meter. Wait one hour and turn on the link again.
593,Automatic export of energy values,Wait until the time for export occurs.
594,Manual export of energy values,Start an export from HES.
596,logging of events,Verify in HES that the events and their attribute values can be displayed in an event list.
615,Setting the number of decimal places,Verify that the number of decimal places displayed corresponds to the number of decimal places configured to be displayed for a measurement value. Verify that the number of decimal places displayed corresponds to the number of decimal places configured to be displayed for a measurement value.
642,Hardware for the user interface,"HES shall be designed to be used with different types of computers, tablets and smart phones, with different architectures and operating systems."
