ID,Feature,Description
S2,Traceable metering devices,"All delivered metering devices, down to component level, shall be traceable and can be linked at least to the manufacturing batch and time of manufacture"
S8,Block switches from HES,The meter switch shall be capable of being blocked from the HES to prevent local switching on of the power.
S12,PQ values to HES within 4h,The PQ values (15-minute values) shall be delivered at the latest within 4 hours from registration in the Metering Units to HES
S28,Lifespan,A metering Unit shall have a life expectancy of 15 years from the date of delivery to GE.
S38,Events linked to HES,Events and associated records (OBIS codes) shall be sent instantaneously to HES.
S58,Cumulative calculator,The metering unit shall be equipped with a cumulative counter and display at least 7 integer digits and 3 decimal digits.
S59,Metering unit display,"The display of the metering unit shall be able to show for each phase the instantaneous value of voltage, current, power for the output and input of electricity."
S60,Correct meter setting,"The meter reading on the Metering Unit shall always match the numerical capacity of the collected Energy Value and the display, even in the event of a rollover."
S72,Resistant labeling,"The marking of the Meter's manufacturing number shall be permanent for the lifetime of the Metering Unit, i.e. no removable tape or print that can be scraped off."
S73,Legible labeling,"The marking of the meter's production number must be clearly legible
- i.e. the font size must not be too small so that the number becomes difficult to read, e.g. for a customer"
S75,Location of the label,"The manufacturing number of the meter shall be placed on a non-removable part (not connection cover, not communication module cover, etc.)."
S86,Management of both primary and secondary registration,"The metering units shall be able to handle both primary and secondary registration of Metrics,"
S89,Metering unit in HES,"In HES there should be functionality for automatic and manual administration:
- Installation of new Metering Unit
- Replacement of the Metering Unit
- Decommissioning of Metering Unit"
S91,Data in HES,"The HES shall handle at least the following types of data:
- Structure data (e.g. Facility ID, Metering Unit)
- Metrics (Metrics with e.g. ID number, status, timestamp)
- Events (Event with e.g. Event ID, times, Alarms)"
S94,Automatic collection of Measured values,The Metering system shall be configurable for regular automatic collection of Metric Values from Metering Units to HES.
S111,Exporting reports and data,"Retrieved measurement and structural data as well as completed reports shall be exportable to any standardized text file format, such as csv."
S116,Scaling of environment,HES shall be scalable so that the required performance can be maintained with increased data volumes.
S135,Time interval for metric values,There shall be functionality to select different time intervals and time resolution for the Metrics presented.
S136,Setting the number of decimal places,"In the HES user interface, it shall be possible to set the number of decimal places to be displayed for a Metric Value."
S137,Recording of Metric value,"The metric value recorded and stored in the HES shall be unadulterated, i.e. exactly the same value as recorded by the Metering Unit."
S139,Events to alert list,Events configured to generate Alarms shall be displayed in an Alarm List.
S143,logging of events,Events in the Metering System shall be logged in an event list in HES.
S147,Display of PQ values,"In HES, it should be possible to analyze and visualize PQ values in e.g. graphs and bar plots."
S148,Time stamp for metric values,Each Metric shall be time stamped with the current time it was received by HES.
S152,Selecting dates with calendar function,"Where there is a need to select dates in HES, this should be possible through a time and calendar function."
S155,Calendar in Swedish format,"HES calendar should be displayed in Swedish format (YYYY-MM-DD, Y=year, M=month, D=day)"
S163,Request further confirmation,"Commands, initiated by the User in HES, which may have serious consequences in case of incorrect handling (deletion of stored measurement and structure data and disconnection and reconnection of power) shall require additional confirmation before execution"
S166,Authorization profiles for user rights,"HES shall have authorization profiles for at least the following user rights:
- Accessing operating system, starting and stopping the system, updating database, changing authorization profiles, etc.
- Input/update of structural data, collection of Metering values, etc.
- Connection and disconnection of the customer installation via the Metering Unit switch
- Access to Metering Unit meter data and settings
- Only 'view', not 'edit'"
S172,Status of switches to other GE system,The HES shall be able to send information to other facility systems if a Metering Unit's circuit breaker is switched on or off.
S174,Status of the customer interface,"In HES, it shall be possible to see whether the Customer Interface in a Metering Unit is enabled or disabled for data sending."
S177,Interpolation in HES,There should be functionality in HES to perform interpolations where the collected value is missing.
S186,Recovery time after communication breakdown max 60 min,The recovery time of the infrastructure communication after a communication breakdown shall not exceed 60 minutes.
S215,Integrations via files,HES should be able to handle integrations via files.
S221,Common Information Model (CIM),The HES system shall support the Common Information Model (CIM) and comply with standard IEC 61968-9 or equivalent when exchanging information with e.g. Distribution Management Systems (DMS) and Meter Data Management Systems (MDMS).
S228,Controlling logout time,The client shall be able to control after how many minutes of inactivity a User is automatically logged out of HES.
S231,Encryption keys,The metering system shall be able to manage and administer the encryption keys of the metering units.
S234,Security log,Everything of importance to the security of the Metering System shall be recorded in a security log or equivalent.
S237,Logging unique identity,The unique identity of the subject shall be recorded for each logged record.
S238,Protection of meters,"The meters shall be protected against intrusion, tampering and execution of unauthorized or malicious code."
S241,Authentication against neighboring systems,Authentication shall be used when the Metering System interacts with neighboring systems.
S259,Dependencies with other systems,Solution design should be such that dependencies on other systems do not cause the system to lose protection.
B1,Corrected measurement values,"If the Metering Unit corrects measured values of voltage and/or current when calculating energy consumption, these values shall also be those used in the Metering System."
B11,Possible overheating,The metering unit shall have the capability to detect connections that may cause overheating.
B15,Measurement and recording / phase,"The metering unit shall be able to measure and record for each phase the minimum, maximum and average value of voltage, current, active and reactive power of the electricity output and input per 5 minutes."
B24,Record communication errors,"The metering system shall record and store information when the following Events occur:
8. communication failure"
B31,Record when power output exceeds limit value,"The metering system shall record and store information when the following Events occur:
15. Total power consumption exceeds the set limit value"
B33,Register overheating in connection,"The metering system shall record and store information when the following Events occur:
17. In case of a overheating in connection"
B34,Configure records to be stored for events,"For each Event, it shall be possible to optionally configure which registers (OBIS codes) in the Metering Unit are to be stored."
B35,Disable sending of Events from specific Metering Unit,It shall be possible to disable the sending of Events from the designated Metering Unit from HES in order not to have to receive a large amount of Events from a particular Metering Unit.
B46,mounting bracket,There shall be a mounting bracket placed on the top of the metering unit for mounting.
B48,sealing device,The sealing device of the metering unit shall be raised and clearly visible for easy and accessible insertion of the sealing wire.
B53,minimum rated current 5A,The metering unit shall be rated for a minimum current of 5 (Imax 100) A.
B62,Energy values to other system within 10 sec,The energy values (15-minute values) shall be exportable from HES via integrations to other systems within 10 seconds after registration in HES.
B71,Help function,The HES user interface shall (LB71) include a help function to assist the User in understanding how to perform tasks using the functionality of the system.
B81,Detecting meters with communication problems,"In HES, it shall be possible for the User to detect and view individual Metering Units that have communication problems."
B83,View meters with communication problems in map,"In HES, it should be possible to visualize Metering Units with communication problems in a graphical view/map that can be zoomed in and out."
B85,View last measurement value and time,The last Metric and the time of communication with the Metering Unit shall be displayed in the HES.
B87,copy static fields,"It shall be possible for the User to be able to copy static fields in HES such as headers, status, responses to Events in the system."
B89,Request further confirmation,"Commands, initiated by the User in HES, which may have serious consequences in case of incorrect handling (deletion of stored measurement and structure data and switching off and on of power) shall require additional confirmation before execution. Other commands shall be executed directly."
B90,Mass deletion,"In HES, there shall be a function to perform mass deletion of overall structure data objects so that all linked relations are also deleted. E.g. that this is implemented via group membership."
B91,Configuring the Metering Unit,Configuration of the Metering Device from HES shall be possible without downloading new Firmware.
B93,Create groups,"Groups should be able to be created dynamically by the User in HES using different parameters, e.g. Facility ID for export of collected data or upgrade of the meter's software where group can be by postal code or meter identity."
B106,Hardware for the user interface,"HES should be designed to work with different types of computers, tablets and smartphones, with different architectures and operating systems."
B113,Synchronization with GE controlled NTP,The metering system and surrounding infrastructure located within GE's network shall be synchronized with GE controlled NTP.
S537,Design of the solution,The Supplier shall design and construct the Solution in accordance with the requirements set out in Appendix B.2.1 Technical Solution Requirements Specification.
S543,Develop test cases,"The supplier shall prepare test cases based on agreed requirements, i.e. agreed Specification unless otherwise agreed."
S545,Testing tools,The Contractor shall use a tool designated by the Contracting Authority to follow the Contracting Authority's reporting of test results. The Contractor is responsible for registering its feedback and the status of the Client's reported errors and comments in the tool. The Client currently uses ReQtest in the defect management process.
S546,The client's test case,The Customer shall have the right to develop own and new test cases based on the Specification. New test cases can be created until Final Acceptance of the Delivery Project.
S548,Test report,"The Contractor shall prepare a test report for the test phases for which the Contractor is responsible during the Delivery Project, as shown in Figure 1 in clause 3.2."
S549,Content of the test report,"The test report shall contain at least: 
-Test cases executed 
-Results of the tests 
-Residual errors, if any 
-Residual test cases, if any 
-Suggested actions"
S555,Retesting after modifications,The supplier shall also report the possible consequences and impact on other functions of the modifications made. The customer has the right to require repetition of the tests made in FAT if such modifications are made.
S557,Scope of UAT,The purchaser's UAT (User Acceptance Test) shall include testing and verification of all requirements according to the Specification unless otherwise agreed.
S558,Training for UAT,The Contractor shall carry out the necessary training and submit the relevant documentation in accordance with Clause 5 prior to the commencement of the Purchaser's UAT.
S559,Support under UAT,The Supplier shall be present at the Purchaser's premises and assist the Purchaser in carrying out the UAT.
S560,Requirements for delivery and installation in the production environment,"During installation and commissioning of the Metering System in the Customer's production environment, the Supplier shall: 
-install, 
-if necessary configure/parameterize, 
-if necessary migrate structural data, 
-commission, 
-verify and test the Metering System including integrations in the production environment, and 
-perform error corrections and retests"
